name,type,manufacturer,first_flight,status,range_km,cruise_speed_kmh,max_speed_kmh,capacity_passengers,crew,length_m,wingspan_m,era,mission,key_features,design_philosophy,short_description
Reims-Cessna F406 Caravan II,aircraft,,,,,,,,,,,Various,aircraft,The Reims-Cessna F406 Caravan II is a turboprop twin engine utility aircraft manufactured and designed by Reims Aviation in cooperation with Cessna.,Wikipedia-sourced,The Reims-Cessna F406 Caravan II is a turboprop twin engine utility aircraft manufactured and designed by Reims Aviation in cooperation with Cessna.
Short S.26,aircraft,,,,,,,,,,,Various,aircraft,"The Short S.26 G-class was a large transport flying boat designed and produced by the British aircraft manufacturer Short Brothers. It was designed to achieve a non-stop transatlantic capability, incr",Wikipedia-sourced,"The Short S.26 G-class was a large transport flying boat designed and produced by the British aircraft manufacturer Short Brothers. It was designed to achieve a non-stop transatlantic capability, increasing the viability of long distant services/duties."
Saunders ST-27,trainer,,,,,,,,,,,Various,trainer,"The Saunders ST-27 was a regional aircraft built in the 1970s by the Canadian Saunders Aircraft Company based at Gimli, Manitoba. The aircraft was designed as a conversion of the earlier de Havilland ",Wikipedia-sourced,"The Saunders ST-27 was a regional aircraft built in the 1970s by the Canadian Saunders Aircraft Company based at Gimli, Manitoba. The aircraft was designed as a conversion of the earlier de Havilland Heron."
Percival Petrel,aircraft,,,,,,,,,,,Various,aircraft,"The Percival Q.6 was a 1930s British communications aircraft built by Percival Aircraft Limited at Luton. Originally, the Percival Q.6 was a civil transport but It was used during the Second World War",Wikipedia-sourced,"The Percival Q.6 was a 1930s British communications aircraft built by Percival Aircraft Limited at Luton. Originally, the Percival Q.6 was a civil transport but It was used during the Second World War by the Royal Air Force and Royal Navy as a communications and liaison aircraft."
Percival Proctor,aircraft,,,,,,,,,,,Various,aircraft,"The Percival Proctor is a British radio trainer and communications aircraft of the Second World War. The Proctor is a single-engined, low-wing monoplane with seating for three or four, depending on th",Wikipedia-sourced,"The Percival Proctor is a British radio trainer and communications aircraft of the Second World War. The Proctor is a single-engined, low-wing monoplane with seating for three or four, depending on the model."
Savoia-Marchetti SM.95,attack,,,,,,,,,,,Various,attack,"The Savoia-Marchetti SM.95 was an Italian four-engine, mid-range transport aircraft, which first flew in 1943. It was the successor of the Savoia-Marchetti SM.75.",Wikipedia-sourced,"The Savoia-Marchetti SM.95 was an Italian four-engine, mid-range transport aircraft, which first flew in 1943. It was the successor of the Savoia-Marchetti SM.75."
Potez SEA VII,aircraft,,,,,,,,,,,Various,aircraft,"The Potez SEA VII, otherwise known simply as the Potez VII, was an early airliner developed in France shortly after the First World War.",Wikipedia-sourced,"The Potez SEA VII, otherwise known simply as the Potez VII, was an early airliner developed in France shortly after the First World War."
De Havilland Comet,aircraft,,,,,,,,,,,Various,aircraft,"The de Havilland DH.106 Comet is a four-engine narrow body aircraft developed and manufactured by de Havilland in the United Kingdom. The world's first commercial jet airliner, the Comet 1 prototype f",Wikipedia-sourced,"The de Havilland DH.106 Comet is a four-engine narrow body aircraft developed and manufactured by de Havilland in the United Kingdom. The world's first commercial jet airliner, the Comet 1 prototype first flew in 1949."
De Havilland Canada DHC-4 Caribou,transport,,,,,,,,,,,Various,transport,The de Havilland Canada DHC-4 Caribou (designated by the United States military as the CV-2 and later C-7 Caribou) is a Canadian specialized cargo aircraft with short takeoff and landing (STOL) capabi,Wikipedia-sourced,"The de Havilland Canada DHC-4 Caribou (designated by the United States military as the CV-2 and later C-7 Caribou) is a Canadian specialized cargo aircraft with short takeoff and landing (STOL) capability developed by de Havilland Canada. The Caribou was first flown in 1958 and although mainly retired from military operations, is still in use in small numbers as a rugged bush airplane."
De Havilland Dragon Rapide,aircraft,,,,,,,,,,,Various,aircraft,"The de Havilland DH.89 Dragon Rapide is a 1930s short-haul biplane airliner developed and produced by British aircraft company de Havilland. Capable of accommodating 6–8 passengers, it proved an econo",Wikipedia-sourced,"The de Havilland DH.89 Dragon Rapide is a 1930s short-haul biplane airliner developed and produced by British aircraft company de Havilland. Capable of accommodating 6–8 passengers, it proved an economical and durable craft, despite its plywood construction."
De Havilland Express,aircraft,,,,,,,,,,,Various,aircraft,"The de Havilland Express, also known as the de Havilland DH.86, was a four-engined passenger aircraft manufactured by the de Havilland Aircraft Company between 1934 and 1937.",Wikipedia-sourced,"The de Havilland Express, also known as the de Havilland DH.86, was a four-engined passenger aircraft manufactured by the de Havilland Aircraft Company between 1934 and 1937."
De Havilland Canada DHC-6 Twin Otter,transport,,,,,,,,,,,Various,transport,The de Havilland Canada DHC-6 Twin Otter is a Canadian STOL (short takeoff and landing) utility aircraft developed by de Havilland Canada in the mid-1960s and still in production. It was built by De H,Wikipedia-sourced,The de Havilland Canada DHC-6 Twin Otter is a Canadian STOL (short takeoff and landing) utility aircraft developed by de Havilland Canada in the mid-1960s and still in production. It was built by De Havilland Canada from 1965 to 1988.
De Havilland Canada DHC-3 Otter,transport,,,,,,,,,,,Various,transport,"The de Havilland Canada DHC-3 Otter is a single-engined, high-wing, propeller-driven, short take-off and landing (STOL) aircraft developed by de Havilland Canada. It was conceived to be capable of per",Wikipedia-sourced,"The de Havilland Canada DHC-3 Otter is a single-engined, high-wing, propeller-driven, short take-off and landing (STOL) aircraft developed by de Havilland Canada. It was conceived to be capable of performing the same roles as the earlier and highly successful Beaver, including as a bush plane, while also being a larger aircraft."
De Havilland Canada DHC-2 Beaver,transport,,,,,,,,,,,Various,transport,The de Havilland Canada DHC-2 Beaver is a single-engined high-wing propeller-driven short takeoff and landing (STOL) aircraft developed and manufactured by de Havilland Canada. It has been primarily o,Wikipedia-sourced,"The de Havilland Canada DHC-2 Beaver is a single-engined high-wing propeller-driven short takeoff and landing (STOL) aircraft developed and manufactured by de Havilland Canada. It has been primarily operated as a bush plane and has been used for a wide variety of utility roles, such as cargo and passenger hauling, aerial application (crop dusting and aerial topdressing), and civil aviation duties."
De Havilland Canada Dash 7,aircraft,,,,,,,,,,,Various,aircraft,"The de Havilland Canada DHC-7, popularly known as the Dash 7, is a turboprop-powered regional airliner with short take-off and landing (STOL) performance. Variants were built with 50–54 seats.",Wikipedia-sourced,"The de Havilland Canada DHC-7, popularly known as the Dash 7, is a turboprop-powered regional airliner with short take-off and landing (STOL) performance. Variants were built with 50–54 seats."
De Havilland Canada DHC-5 Buffalo,transport,,,,,,,,,,,Various,transport,The de Havilland Canada DHC-5 Buffalo is a short takeoff and landing (STOL) utility transport turboprop aircraft developed from the earlier piston-powered DHC-4 Caribou. The aircraft has extraordinary,Wikipedia-sourced,The de Havilland Canada DHC-5 Buffalo is a short takeoff and landing (STOL) utility transport turboprop aircraft developed from the earlier piston-powered DHC-4 Caribou. The aircraft has extraordinary STOL performance and is able to take off in distances much shorter than even most light aircraft can manage.
De Havilland Dragon,aircraft,,,,,,,,,,,Various,aircraft,The de Havilland DH.84 Dragon is a successful small commercial aircraft that was designed and built by the de Havilland company.,Wikipedia-sourced,The de Havilland DH.84 Dragon is a successful small commercial aircraft that was designed and built by the de Havilland company.
De Havilland Dove,aircraft,,,,,,,,,,,Various,aircraft,"The de Havilland DH.104 Dove is a British short-haul airliner developed and manufactured by de Havilland. The design, which was a monoplane successor to the pre-war Dragon Rapide biplane, came about f",Wikipedia-sourced,"The de Havilland DH.104 Dove is a British short-haul airliner developed and manufactured by de Havilland. The design, which was a monoplane successor to the pre-war Dragon Rapide biplane, came about from the Brabazon Committee report which, amongst other aircraft types, called for a British-designed short-haul feeder for airlines."
De Havilland Fox Moth,aircraft,,,,,,,,,,,Various,aircraft,"The DH.83 Fox Moth is a small biplane passenger aircraft from the 1930s powered by a single de Havilland Gipsy Major I inline inverted engine, manufactured by the de Havilland Aircraft Company.
The ai",Wikipedia-sourced,"The DH.83 Fox Moth is a small biplane passenger aircraft from the 1930s powered by a single de Havilland Gipsy Major I inline inverted engine, manufactured by the de Havilland Aircraft Company.
The aircraft was designed late in 1931 as a low-cost, light passenger aircraft."
De Havilland Dragonfly,aircraft,,,,,,,,,,,Various,aircraft,The de Havilland DH.90 Dragonfly is a 1930s British twin-engined luxury touring biplane built by the de Havilland Aircraft Company at Hatfield Aerodrome.,Wikipedia-sourced,The de Havilland DH.90 Dragonfly is a 1930s British twin-engined luxury touring biplane built by the de Havilland Aircraft Company at Hatfield Aerodrome.
De Havilland DH.50,aircraft,,,,,,,,,,,Various,aircraft,"The de Havilland DH.50 was a 1920s British large single-engined biplane transport built by de Havilland at Stag Lane Aerodrome, Edgware, and licence-built in Australia, Belgium, and Czechoslovakia.",Wikipedia-sourced,"The de Havilland DH.50 was a 1920s British large single-engined biplane transport built by de Havilland at Stag Lane Aerodrome, Edgware, and licence-built in Australia, Belgium, and Czechoslovakia."
De Havilland DH.18,aircraft,,,,,,,,,,,Various,aircraft,The de Havilland DH.18 was a single-engined British biplane transport aircraft of the 1920s built by de Havilland.,Wikipedia-sourced,The de Havilland DH.18 was a single-engined British biplane transport aircraft of the 1920s built by de Havilland.
De Havilland DH.34,aircraft,,,,,,,,,,,Various,aircraft,"The de Havilland DH.34 was a single engined British biplane airliner built by the de Havilland Aircraft Company in the 1920s. 12 were built, with the DH.34 serving with Imperial Airways and its predec",Wikipedia-sourced,"The de Havilland DH.34 was a single engined British biplane airliner built by the de Havilland Aircraft Company in the 1920s. 12 were built, with the DH.34 serving with Imperial Airways and its predecessors for several years."
AEA Maverick,aircraft,,,,,,,,,,,Various,aircraft,"The Aero Engineers Australia (AEA) Maverick is a single-seat sportsplane of conventional configuration.  Constructed largely of composite materials, it is powered by a 75 kW (100 hp) Continental O-200",Wikipedia-sourced,"The Aero Engineers Australia (AEA) Maverick is a single-seat sportsplane of conventional configuration.  Constructed largely of composite materials, it is powered by a 75 kW (100 hp) Continental O-200A engine and is capable of manoeuvres with loads of up to +6 or −3 g."
AEG B.I,aircraft,,,,,,,,,,,Various,aircraft,The AEG B.I was a German two-seat biplane unarmed reconnaissance aircraft produced in very small numbers in 1914.,Wikipedia-sourced,The AEG B.I was a German two-seat biplane unarmed reconnaissance aircraft produced in very small numbers in 1914.
ADI Condor,aircraft,,,,,,,,,,,Various,aircraft,"The ADI Condor was a motor glider of unusual configuration built in the United States in 1981. While most motor gliders follow traditional sailplane layout, the Condor was of twin-boom configuration, ",Wikipedia-sourced,"The ADI Condor was a motor glider of unusual configuration built in the United States in 1981. While most motor gliders follow traditional sailplane layout, the Condor was of twin-boom configuration, with twin, inwardly canted tail fins joined at their tips by a common horizontal stabilizer."
ADI Sportster,aircraft,,,,,,,,,,,Various,aircraft,The ADI Sportster is a two-seat gyroplane that has been marketed in plans form for homebuilding since 1974 by Aircraft Designs Inc. It was the first homebuilt gyrocopter design to be able to carry a p,Wikipedia-sourced,The ADI Sportster is a two-seat gyroplane that has been marketed in plans form for homebuilding since 1974 by Aircraft Designs Inc. It was the first homebuilt gyrocopter design to be able to carry a passenger.
ADI Stallion,aircraft,,,,,,,,,,,Various,aircraft,The ADI Stallion is a US civil utility aircraft that first flew in July 1994. It is marketed in kit form for homebuilding by Aircraft Designs Inc.,Wikipedia-sourced,The ADI Stallion is a US civil utility aircraft that first flew in July 1994. It is marketed in kit form for homebuilding by Aircraft Designs Inc.
AEA Red Wing,aircraft,,,,,,,,,,,Various,aircraft,The Red Wing (or Aerodrome #1) was an early aircraft designed by Thomas Selfridge and built by the Aerial Experiment Association in 1908. It was named for the bright red color of its silk wings — chos,Wikipedia-sourced,The Red Wing (or Aerodrome #1) was an early aircraft designed by Thomas Selfridge and built by the Aerial Experiment Association in 1908. It was named for the bright red color of its silk wings — chosen to achieve the best result with the photographic materials and techniques of the day.
AEA June Bug,aircraft,,,,,,,,,,,Various,aircraft,"The June Bug was an American ""pioneer era"" biplane built by the Aerial Experiment Association (A.E.A) in 1908 and flown by Glenn Hammond Curtiss. The aircraft was the first American airplane to fly at",Wikipedia-sourced,"The June Bug was an American ""pioneer era"" biplane built by the Aerial Experiment Association (A.E.A) in 1908 and flown by Glenn Hammond Curtiss. The aircraft was the first American airplane to fly at least 1 km in front of a crowd."
AEF Monotrace,aircraft,,,,,,,,,,,Various,aircraft,"The AEF Monotrace is a French ultralight trike, designed and produced by AEF Air Lift System of Houilles. The aircraft is supplied as a complete ready-to-fly-aircraft.",Wikipedia-sourced,"The AEF Monotrace is a French ultralight trike, designed and produced by AEF Air Lift System of Houilles. The aircraft is supplied as a complete ready-to-fly-aircraft."
AEG B.III,aircraft,,,,,,,,,,,Various,aircraft,"The AEG B.III was a German two-seat biplane reconnaissance aircraft produced in very small numbers from 1915. It was a further refinement of the B.I and B.II, with a fresh tailplane assembly, but was ",Wikipedia-sourced,"The AEG B.III was a German two-seat biplane reconnaissance aircraft produced in very small numbers from 1915. It was a further refinement of the B.I and B.II, with a fresh tailplane assembly, but was still only just adequate in performance and did not attract much interest."
AEG C.III,aircraft,,,,,,,,,,,Various,aircraft,The AEG C.III was a prototype two-seat biplane reconnaissance aircraft built by the Allgemeine Elektricitäts-Gesellschaft (AEG) during the First World War for the Imperial German Army's (Deutsches Hee,Wikipedia-sourced,"The AEG C.III was a prototype two-seat biplane reconnaissance aircraft built by the Allgemeine Elektricitäts-Gesellschaft (AEG) during the First World War for the Imperial German Army's (Deutsches Heer) Imperial German Air Service (Luftstreitkräfte). It was derived from the C.II, but with a new fuselage that completely filled the gap between the wings."
AEG C.VIII,aircraft,,,,,,,,,,,Various,aircraft,The AEG C.VIII was a prototype two-seat reconnaissance aircraft built by the Allgemeine Elektricitäts-Gesellschaft (AEG) during the First World War for the Imperial German Army's (Deutsches Heer) Impe,Wikipedia-sourced,"The AEG C.VIII was a prototype two-seat reconnaissance aircraft built by the Allgemeine Elektricitäts-Gesellschaft (AEG) during the First World War for the Imperial German Army's (Deutsches Heer) Imperial German Air Service (Luftstreitkräfte).
Three examples were built in an effort to improve on the unsuccessful C.VII design, two of biplane configuration, the other a triplane (the latter sometimes..."
AEG D.I,aircraft,,,,,,,,,,,Various,aircraft,The AEG D.I was a prototype biplane fighter built by the Allgemeine Elektricitäts-Gesellschaft (AEG) during the First World War for the Imperial German Army's (Deutsches Heer) Imperial German Air Serv,Wikipedia-sourced,"The AEG D.I was a prototype biplane fighter built by the Allgemeine Elektricitäts-Gesellschaft (AEG) during the First World War for the Imperial German Army's (Deutsches Heer) Imperial German Air Service (Luftstreitkräfte). Three prototypes were ordered in 1917, but after the first two were involved in fatal crashes, development was cancelled."
AEG DJ.I,aircraft,AEG,,Active,,,,,,,,Various,aircraft,The AEG DJ.I was a prototype biplane fighter that was built by the Allgemeine Elektricitäts-Gesellschaft (AEG) during the First World War for the Imperial German Army's (Deutsches Heer) Imperial Germa,Wikipedia-sourced,"The AEG DJ.I was a prototype biplane fighter that was built by the Allgemeine Elektricitäts-Gesellschaft (AEG) during the First World War for the Imperial German Army's (Deutsches Heer) Imperial German Air Service (Luftstreitkräfte). It was derived from the unsuccessful AEG PE triplane fighter and shared the same armoured fuselage design, armament and engine."
AEG G.II,aircraft,,,,,,,,,,,Various,aircraft,The AEG G.II was a biplane bomber built by the Allgemeine Elektricitäts-Gesellschaft (AEG) during the First World War for the Imperial German Army's (Deutsches Heer) Imperial German Air Service (Lufts,Wikipedia-sourced,The AEG G.II was a biplane bomber built by the Allgemeine Elektricitäts-Gesellschaft (AEG) during the First World War for the Imperial German Army's (Deutsches Heer) Imperial German Air Service (Luftstreitkräfte). It was an improved version of the AEG G.I with more powerful engines.
AEG G.IV,aircraft,,,,,,,,,,,Various,aircraft,The AEG G.IV was a biplane bomber aircraft designed and produced by the German aircraft manufacturer Allgemeine Elektrizitäts-Gesellschaft. It saw action during the First World War with the Luftstreit,Wikipedia-sourced,The AEG G.IV was a biplane bomber aircraft designed and produced by the German aircraft manufacturer Allgemeine Elektrizitäts-Gesellschaft. It saw action during the First World War with the Luftstreitkräfte (Imperial German Army Air Service).
AEG N.I,aircraft,,,,,,,,,,,Various,aircraft,The AEG N.I was a German biplane night-bomber which saw limited action during World War I. A total of 37 were built. Several were used postwar as airliners.,Wikipedia-sourced,The AEG N.I was a German biplane night-bomber which saw limited action during World War I. A total of 37 were built. Several were used postwar as airliners.
AEG PE,aircraft,,,,,,,,,,,Various,aircraft,"The AEG PE (factory designation Panzer Einsitzer – ""armoured one-seater"") was a prototype triplane fighter built by the Allgemeine Elektricitäts-Gesellschaft (AEG) during the First World War for the I",Wikipedia-sourced,"The AEG PE (factory designation Panzer Einsitzer – ""armoured one-seater"") was a prototype triplane fighter built by the Allgemeine Elektricitäts-Gesellschaft (AEG) during the First World War for the Imperial German Army's (Deutsches Heer) Imperial German Air Service (Luftstreitkräfte). It was intended to attack enemy ground-attack aircraft at low level within range of anti-aircraft defenses."
AEKKEA-RAAB,attack,,,,,,,,,,,Various,attack,"The history of AEKKEA (Anonymos Etaireia Kataskevis Kai Ekmetallefseos Aeroplanon - Societe Anonyme Pour la Fabrication et l'Exploitation des Avions Raab), an aircraft maker based in Greece, is connec",Wikipedia-sourced,"The history of AEKKEA (Anonymos Etaireia Kataskevis Kai Ekmetallefseos Aeroplanon - Societe Anonyme Pour la Fabrication et l'Exploitation des Avions Raab), an aircraft maker based in Greece, is connected with the history of a talented German aircraft designer, Antonius Raab (his first name alternatively known as Antonios, in Greek, and Antonio, in Spanish after his involvement in Spain)."
AEG Wagner Eule,aircraft,,,,,,,,,,,Various,aircraft,The AEG Wagner Eule was a German reconnaissance aircraft built in 1914 by Allgemeine Electricitäts Gesellschaft.,Wikipedia-sourced,The AEG Wagner Eule was a German reconnaissance aircraft built in 1914 by Allgemeine Electricitäts Gesellschaft.
Abrams Air Craft,aircraft,,,,,,,,,,,Various,aircraft,"The Abrams Air Craft Corporation was an aircraft manufacturer established in Lansing, Michigan, USA, in 1937 as an offshoot of Talbert Abrams' Aerial Survey Corporation. Abrams had founded an airline ",Wikipedia-sourced,"The Abrams Air Craft Corporation was an aircraft manufacturer established in Lansing, Michigan, USA, in 1937 as an offshoot of Talbert Abrams' Aerial Survey Corporation. Abrams had founded an airline (ABC Airline) in 1929 but found himself increasingly interested in aerial photography."
ATA Cruiser,aircraft,,,,,,,,,,,Various,aircraft,"The Adams-Toman Cruiser was a US-built civil utility aircraft of the 1920s. It was a three-seat, high-wing monoplane with an enclosed cabin, and possibly a variant of the Grays Harbor Activian.",Wikipedia-sourced,"The Adams-Toman Cruiser was a US-built civil utility aircraft of the 1920s. It was a three-seat, high-wing monoplane with an enclosed cabin, and possibly a variant of the Grays Harbor Activian."
AGO C.I,aircraft,,,,,,,,,,,Various,aircraft,The AGO C.I was a First World War German pusher reconnaissance biplane that used a pod-and-boom configuration.,Wikipedia-sourced,The AGO C.I was a First World War German pusher reconnaissance biplane that used a pod-and-boom configuration.
AGO C.IV,aircraft,,,,,,,,,,,Various,aircraft,The AGO C.IV was a German biplane reconnaissance aircraft designed and produced by the German aircraft manufacturer AGO Flugzeugwerke. It was active with the Luftstreitkräfte during the latter half of,Wikipedia-sourced,The AGO C.IV was a German biplane reconnaissance aircraft designed and produced by the German aircraft manufacturer AGO Flugzeugwerke. It was active with the Luftstreitkräfte during the latter half of the First World War.
AGO C.VIII,aircraft,,,,,,,,,,,Various,aircraft,The AGO C.VIII was a German reconnaissance aircraft built by AGO Flugzeugwerke during World War I.,Wikipedia-sourced,The AGO C.VIII was a German reconnaissance aircraft built by AGO Flugzeugwerke during World War I.
AGO S.I,aircraft,,,,,,,,,,,Various,aircraft,The AGO S.I was a German prototype ground-attack aircraft built in October 1918 but possibly never flown before the end of World War I. It was a single-seat biplane armed with a downwards-firing 20 mm,Wikipedia-sourced,The AGO S.I was a German prototype ground-attack aircraft built in October 1918 but possibly never flown before the end of World War I. It was a single-seat biplane armed with a downwards-firing 20 mm cannon.
Abbott-Baynes Scud 2,trainer,,,,,,,,,,,Various,trainer,"The Abbott-Baynes Scud 2 was a 1930s high-performance sailplane, built in the UK.  It was a development of the intermediate-level Scud 1 with a new, high aspect ratio wing.",Wikipedia-sourced,"The Abbott-Baynes Scud 2 was a 1930s high-performance sailplane, built in the UK.  It was a development of the intermediate-level Scud 1 with a new, high aspect ratio wing."
ARV Griffin,aircraft,,,Active,,,,,,,,Various,aircraft,"The ARV Griffin is a Canadian homebuilt aircraft that was designed by Dave Marsden of the University of Alberta and produced by Canada Air RV and later by AC Millennium Corp, both of Edmonton. When it",Wikipedia-sourced,"The ARV Griffin is a Canadian homebuilt aircraft that was designed by Dave Marsden of the University of Alberta and produced by Canada Air RV and later by AC Millennium Corp, both of Edmonton. When it was available the aircraft was supplied as a kit for amateur construction."
AME VI,aircraft,,,,,,,,,,,Various,aircraft,"The AME VI was a reconnaissance aircraft, produced in Spain in the mid 1920s.",Wikipedia-sourced,"The AME VI was a reconnaissance aircraft, produced in Spain in the mid 1920s."
Acme Aircraft Corporation,aircraft,,,,,,,,,,,Various,aircraft,"The Acme Aircraft Corporation was an American aircraft manufacturer based in Rockford, Illinois, founded in 1928.
The company president was R.S. Link and the general manager was P.H. Ryan.",Wikipedia-sourced,"The Acme Aircraft Corporation was an American aircraft manufacturer based in Rockford, Illinois, founded in 1928.
The company president was R.S. Link and the general manager was P.H. Ryan."
