name,type,manufacturer,first_flight,status,range_km,cruise_speed_kmh,max_speed_kmh,capacity_passengers,crew,length_m,wingspan_m,era,mission,key_features,design_philosophy,short_description
F-16 Fighting Falcon,fighter,Lockheed Martin,1974,Active,3900,850,2124,,1,15.03,9.96,4th generation (1970s-80s),multirole air superiority and ground attack,"Single engine, bubble canopy, side-stick, fly-by-wire, relaxed static stability, cropped delta wing, 9-g capable, M61 cannon","Lightweight Fighter program: small agile aircraft, high thrust-to-weight, energy-maneuverability theory, low cost, easy maintenance",American single-engine supersonic multirole fighter. Designed for day fighter evolved to all-weather. Most common fixed-wing military aircraft. Bubble canopy and reclined seat reduce g-force. First fighter purpose-built for 9-g maneuvers.
F-22 Raptor,fighter,Lockheed Martin,1997,Active,2960,1838,2410,,1,18.9,13.56,5th generation (1990s-2000s),air superiority with ground attack and electronic warfare,"Twin engine, stealth, supercruise (Mach 1.5 without afterburner), supermaneuverability, thrust vectoring, internal weapons bays, sensor fusion","Advanced Tactical Fighter: dominate contested airspace, combine stealth with speed and agility, first to integrate supercruise and supermaneuverability","American twin-engine stealth air superiority fighter. First operational 5th-gen. Combines stealth, supercruise, supermaneuverability. Diamond delta wings, canted tails. Replaced F-15 in USAF squadrons."
Supermarine Spitfire,fighter,Supermarine,1936,Retired,760,580,717,,1,9.12,11.23,WWII (1936-1948),interceptor and fighter-bomber,"Elliptical wing, Rolls-Royce Merlin/Griffon engine, stressed-skin monocoque, thin wing cross-section, eight-gun armament","Thinnest possible wing for speed, elegant aerodynamics from Schneider Trophy seaplanes, home defense interceptor",British single-seat fighter. Icon of Battle of Britain. Elliptical wing minimized induced drag. Evolved through many variants from Mk I to Mk 24. Only British fighter in continuous production throughout WWII.
SR-71 Blackbird,reconnaissance,Lockheed,1964,Retired,5400,3060,3540,,2,32.74,16.94,Cold War (1960s-1990s),strategic high-altitude reconnaissance,"Mach 3.2+, 85000 ft altitude, titanium airframe, chines for lift and stealth, J58 engines, signals intel and cameras","Speed and altitude as survivability: outrun missiles, fly above threats, minimal radar cross-section via shaping",American long-range Mach 3+ strategic reconnaissance aircraft. Operated at 85000 ft. Evaded threats by accelerating. Titanium construction for thermal expansion. Still holds speed and altitude records.
Lockheed U-2,reconnaissance,Lockheed,1955,Active,10600,690,821,,1,19.2,31.4,Cold War to present,high-altitude intelligence gathering,"Single engine, 70000+ ft ceiling, glider-like high aspect ratio wings, bicycle landing gear, specialized cameras","Fly above enemy reach: altitude over speed, sailplane-inspired lightweight design, 70k ft beyond interceptors",American single-engine high-altitude reconnaissance. Dragon Lady. Designed for 70000 ft over Soviet Union. Glider-like 23:1 glide ratio. Narrow coffin corner at cruise. Difficult to fly and land.
F-117 Nighthawk,attack,Lockheed,1981,Retired,1720,684,993,,1,20.09,13.2,Cold War (1980s-2000s),stealth precision strike,"Faceted flat surfaces for radar deflection, subsonic, twin engine, internal weapons bay, fly-by-wire for unstable design","First operational stealth: faceted surfaces scatter radar, subsonic to avoid sonic boom, attack not dogfight","American stealth attack aircraft. Faceted shape minimizes radar cross-section. Aerodynamically unstable requires constant fly-by-wire. First operational stealth design. Retired 2008, some kept for training."
B-52 Stratofortress,bomber,Boeing,1952,Active,14160,844,957,,5,48.5,56.4,Cold War to present,strategic bombing nuclear and conventional,"Eight turbojet engines, swept wings, 70000 lb weapons capacity, 8800 mile unrefueled range, flexible airframe","Long-range heavy payload: outlast competitors, flexible design, low operating cost, conventional and nuclear","American subsonic strategic bomber. BUFF. In service since 1955. Carries 70000 lb of weapons. Long range without refueling. Used in Vietnam, Gulf War, Afghanistan. Expected to serve into 2050s."
A-10 Thunderbolt II,attack,Fairchild Republic,1972,Active,3900,560,706,,1,16.26,17.53,1970s to present,close air support,"GAU-8 30mm cannon, titanium bathtub armor, straight wing, twin turbofan, high survivability, short rough-field takeoff","Tank killer: built around cannon, survivability over speed, loiter time, operate from austere forward bases",American single-seat close air support. Warthog. Airframe designed around GAU-8 Avenger cannon. 1200 lb titanium armor protects pilot. Can absorb damage and continue. Short takeoff from unpaved runways.
Concorde,airliner,BAC / Aerospatiale,1969,Retired,7250,2145,2330,128,3,61.66,25.6,supersonic era (1969-2003),supersonic transatlantic passenger,"Ogival delta wing, four Olympus turbojets with reheat, droop nose, Mach 2 cruise, aluminium construction","Double speed of sound: slender delta for supersonic efficiency, vortex lift for low-speed, premium travel","Anglo-French supersonic airliner. Mach 2 transatlantic. Ogival delta wing, variable intake ramps. First airliner with analogue fly-by-wire. Retired 2003. Only competitor was Tu-144."
F-4 Phantom II,fighter,McDonnell Douglas,1958,Active,2600,940,2370,,2,19.2,11.7,Cold War (1960s-1990s),interceptor and fighter-bomber,"Twin engine, Mach 2.2, two-seat, no internal cannon initially, nine hardpoints, 18000 lb weapons","Multirole heavy fighter: speed and payload over agility, radar-guided missiles, fleet defense and strike","American twin-engine supersonic interceptor and fighter-bomber. Most produced American supersonic military aircraft. Set 15 world records. Vietnam War workhorse. Evolved for air superiority, ground attack, reconnaissance."
B-2 Spirit,bomber,Northrop Grumman,1989,Active,11100,900,1010,,2,21,52.4,Cold War to present,stealth strategic bombing,"Flying wing, subsonic, two crew, lambda wing planform, low observables, internal weapons, 6000+ nmi range","Penetrate defended airspace: pure flying wing for stealth, no vertical surfaces, curved composite surfaces",American stealth strategic bomber. Flying wing design. Penetrates sophisticated air defenses. 6000+ nmi unrefueled range. Conventional and nuclear. Replaced B-1A. Only 21 built. Cost $2B+ each.
C-17 Globemaster III,transport,Boeing,1991,Active,4480,830,833,102,3,53,51.75,1990s to present,strategic and tactical airlift,"Four turbofan engines, swept wing, STOL capability, rear ramp, airdrop, 170000 lb payload","Strategic and tactical in one: large payload, short rough-field landing, replace C-141 and augment C-5",American military transport. Strategic and tactical airlift. Based on YC-15. Carries troops and cargo. Medical evacuation and airdrop. Replaced C-141. Operates from austere runways.
Hawker Siddeley Harrier,attack,Hawker Siddeley,1966,Retired,3425,850,1185,,1,14.27,7.7,Cold War (1967-2006),V/STOL ground attack,"Vertical takeoff and landing, vectored thrust Pegasus engine, four swivelling nozzles, ski-jump launch","First operational V/STOL: operate without runways, disperse from vulnerable bases, amphibious assault",British V/STOL ground-attack aircraft. First operational fixed-wing V/STOL. Pegasus vectored-thrust engine. Operated from carriers and forward bases. Falklands War. Evolved to Sea Harrier and AV-8B Harrier II.
F-15 Eagle,fighter,McDonnell Douglas,1972,Active,3900,917,2655,,1,19.43,13.05,4th generation (1970s-present),air superiority,"Twin engine, high thrust-to-weight (>1), bubble canopy, all-weather, Mach 2.5, 8 hardpoints","Not a pound for air-to-ground: pure air superiority, outclimb and outaccelerate any threat, look-down shoot-down",American twin-engine air superiority fighter. Thrust-to-weight greater than one. Designed to counter Soviet fighters. Undefeated in air-to-air combat. Evolved to F-15E Strike Eagle for dual role.
F-14 Tomcat,fighter,Grumman,1970,Retired,2960,740,2485,,2,19.1,19.55,Cold War (1970s-2006),fleet air defense,"Variable-sweep wing, two-seat, AIM-54 Phoenix missile, twin engine, AWG-9 radar","Fleet defender: variable geometry for carrier and speed, long-range Phoenix, intercept at distance",American variable-sweep wing fleet defense fighter. Swing wings optimize for low-speed carrier and high-speed intercept. Phoenix missile for long range. Top Gun fame. Replaced by F/A-18.
C-130 Hercules,transport,Lockheed Martin,1954,Active,3800,540,592,92,5,29.79,40.41,Cold War to present,tactical airlift,"Four turboprop engines, high wing, rear ramp, STOL, 42000 lb payload, rough field capable","Tactical workhorse: operate anywhere, reliable, versatile, airdrop and assault, 60+ years in production","American four-engine turboprop tactical transport. High wing, rear ramp. STOL from rough strips. Airdrop, assault, medevac, tanker variants. Most produced military transport. In production since 1954."
MiG-21,fighter,Mikoyan-Gurevich,1955,Active,1210,850,2175,,1,15.76,7.15,Cold War (1950s-present),lightweight interceptor,"Delta wing, single engine, small radar cross-section, Mach 2, tailed delta, minimal frontal area","Minimalist interceptor: small, fast, cheap, point defense, GCI-guided, mass production for Warsaw Pact","Soviet single-engine supersonic fighter. Most produced jet aircraft. Delta wing, tailed configuration. Lightweight point-defense interceptor. Used by 60+ nations. Simple and reliable."
Boeing 747,airliner,Boeing,1969,Active,14815,913,988,524,3,76.3,68.4,jet age (1969-present),long-haul wide-body passenger and cargo,"Four engines, hump upper deck, wide body, 400+ passengers, long range, cargo and passenger variants","Jumbo Jet: double capacity, economy of scale, cargo capability, cockpit above main deck for nose loading",American wide-body commercial airliner. Jumbo Jet. First twin-aisle. Hump for cockpit and upper deck. Cargo nose door. Revolutionized long-haul travel. Queen of the Skies.
F-35 Lightning II,fighter,Lockheed Martin,2006,Active,2220,1223,1930,,1,15.67,10.7,5th generation (2006-present),multirole stealth strike,"Single engine, stealth, sensor fusion, STOVL variant, internal weapons, distributed aperture system","Joint strike fighter: one airframe three variants (conventional, carrier, STOVL), stealth multirole, international","American single-engine stealth multirole. F-35A conventional, F-35B STOVL, F-35C carrier. Sensor fusion. Replacing F-16, A-10, F/A-18, Harrier. International program."
C-5 Galaxy,transport,Lockheed Martin,1968,Active,4440,830,932,345,7,75.3,67.89,Cold War to present,strategic heavy airlift,"Four turbofan engines, nose and rear loading, 265000 lb payload, outsize cargo, 2700 nmi range","Heavy lifter: largest USAF cargo, main battle tanks, outsize loads, nose and tail doors for drive-through","American strategic heavy airlift. Largest military transport. Nose and rear loading. Carries main battle tanks, helicopters. Replaced C-141 for heaviest loads. C-5M modernized."
3I Sky Arrow,aircraft,,,,,,,,,,,Various,aircraft,"The Sky Arrow is a tandem two-seat, high-wing pusher light aircraft that was manufactured by 3I (Iniziative Industriali Italiane). 
3I entered bankruptcy proceedings in 2008, and in 2012 the design wa",Wikipedia-sourced,"The Sky Arrow is a tandem two-seat, high-wing pusher light aircraft that was manufactured by 3I (Iniziative Industriali Italiane). 
3I entered bankruptcy proceedings in 2008, and in 2012 the design was purchased by Magnaghi Aeronautica, of Naples, Italy."
3Xtrim 3X55 Trener,aircraft,,,,,,,,,,,Various,aircraft,"The 3X55 Trener (Trainer) and 3X47 Ultra are a family of ultralight aircraft produced in Poland by the 3Xtrim Aircraft Factory. Both are two-seat, high-wing, strut-braced monoplanes with fixed tricycl",Wikipedia-sourced,"The 3X55 Trener (Trainer) and 3X47 Ultra are a family of ultralight aircraft produced in Poland by the 3Xtrim Aircraft Factory. Both are two-seat, high-wing, strut-braced monoplanes with fixed tricycle undercarriage and available only as completed aircraft."
3Xtrim Aircraft Factory,aircraft,,,,,,,,,,,Various,aircraft,"The 3Xtrim Aircraft Factory, or Zakłady Lotnicze 3Xtrim Sp.z o.o.in Polish, was an aircraft manufacturer located in the city of Bielsko-Biała, in southern Poland.
The company was established by former",Wikipedia-sourced,"The 3Xtrim Aircraft Factory, or Zakłady Lotnicze 3Xtrim Sp.z o.o.in Polish, was an aircraft manufacturer located in the city of Bielsko-Biała, in southern Poland.
The company was established by former SZD sailplane engineer Adam Kurbiel in 1996 under the name Wytwórnia i Naprawa Konstrukcji Lekkich - A. Kurbiel."
A-90 Orlyonok,attack,,,,,,,,,,,Various,attack,"The A-90 Orlyonok (Russian: Орлёнок, lit. 'Eaglet') is a Soviet ekranoplan that was designed by Rostislav Evgenievich Alexeyev of the Central Hydrofoil Design Bureau.
The A-90 uses ground effect to fl",Wikipedia-sourced,"The A-90 Orlyonok (Russian: Орлёнок, lit. 'Eaglet') is a Soviet ekranoplan that was designed by Rostislav Evgenievich Alexeyev of the Central Hydrofoil Design Bureau.
The A-90 uses ground effect to fly a few meters above the surface."
A-B Helicopters A/W 95,attack,,,,,,,,,,,Various,attack,"The A-B Helicopters A/W 95 is an American helicopter, produced by A-B Helicopters in the form of plans for amateur construction.
By 2012 the A-B Helicopters website had been taken down and plans are n",Wikipedia-sourced,"The A-B Helicopters A/W 95 is an American helicopter, produced by A-B Helicopters in the form of plans for amateur construction.
By 2012 the A-B Helicopters website had been taken down and plans are no longer available."
A-I-R Atos,attack,,,,,,,,,,,Various,attack,"The A-I-R Atos is a German high-wing, single-place, rigid wing hang glider designed by Felix Ruehle and produced by A-I-R GmbH of Halblech.",Wikipedia-sourced,"The A-I-R Atos is a German high-wing, single-place, rigid wing hang glider designed by Felix Ruehle and produced by A-I-R GmbH of Halblech."
A2 CZ Ellipse Spirit,aircraft,,,,,,,,,,,Various,aircraft,"The A2 CZ Ellipse Spirit (sometimes spelled Elipse Spirit) is a Czech ultralight aircraft, designed and produced by A2 CZ. The aircraft was introduced at the Aero show in 2011 and is supplied complete",Wikipedia-sourced,"The A2 CZ Ellipse Spirit (sometimes spelled Elipse Spirit) is a Czech ultralight aircraft, designed and produced by A2 CZ. The aircraft was introduced at the Aero show in 2011 and is supplied complete and ready to fly or as a kit for amateur construction."
A41 Factory VNS-41,aircraft,,,,,,,,,,,Various,aircraft,The VNS-41 is the first amphibious microlight aircraft made in Vietnam. The A41 Factory (officially Aircraft Repair Company A-41) under the Air Force and Air Defence Department (Ministry of Defence) m,Wikipedia-sourced,The VNS-41 is the first amphibious microlight aircraft made in Vietnam. The A41 Factory (officially Aircraft Repair Company A-41) under the Air Force and Air Defence Department (Ministry of Defence) manufactured the aircraft based on the Russian Che-22 Korvet design by Boris Chernov and E. Yungerov.
AAC Angel,aircraft,,,,,,,,,,,Various,aircraft,The Angel Aircraft Corporation Model 44 Angel is a twin-engine STOL utility aircraft produced in the United States since the mid-1990s.  Designed by Carl Mortenson and The King's Engineering Fellowshi,Wikipedia-sourced,"The Angel Aircraft Corporation Model 44 Angel is a twin-engine STOL utility aircraft produced in the United States since the mid-1990s.  Designed by Carl Mortenson and The King's Engineering Fellowship to be well-suited for missionary work from remote locations around the world, it is a low-wing cantilever monoplane with a retractable tricycle undercarriage and eight seats."
AAC SeaStar,aircraft,,,,,,,,,,,Various,aircraft,"The AAC SeaStar is an amphibious biplane that was produced in kitplane form. The aircraft is built largely of composite materials and features wings that may be easily removed for transport, and a bal",Wikipedia-sourced,"The AAC SeaStar is an amphibious biplane that was produced in kitplane form. The aircraft is built largely of composite materials and features wings that may be easily removed for transport, and a ballistic recovery system in the form of a parachute that can be deployed from the engine nacelle."
AAC Seastar Sealoon,aircraft,,,,,,,,,,,Various,aircraft,"The AAC Seastar Sealoon is a Canadian amateur-built flying boat, under development by Amphibian Airplanes of Canada. The aircraft is intended to be supplied as a kit for amateur construction.",Wikipedia-sourced,"The AAC Seastar Sealoon is a Canadian amateur-built flying boat, under development by Amphibian Airplanes of Canada. The aircraft is intended to be supplied as a kit for amateur construction."
AAI Aerosonde,aircraft,,,,,,,,,,,Various,aircraft,"The AAI Aerosonde is a small unmanned aerial vehicle (UAV) designed to collect weather data, including temperature, atmospheric pressure, humidity, and wind measurements over oceans and remote areas. ",Wikipedia-sourced,"The AAI Aerosonde is a small unmanned aerial vehicle (UAV) designed to collect weather data, including temperature, atmospheric pressure, humidity, and wind measurements over oceans and remote areas.  The Aerosonde was developed by Insitu, and is now manufactured by Aerosonde Ltd, which is a strategic business of AAI Corporation."
AAI Corporation,aircraft,,,,,,,,,,,Various,aircraft,"AAI Corporation is an aerospace and defense development and manufacturing firm, located in Hunt Valley, Maryland, US. Formerly a wholly owned subsidiary of United Industrial Corporation, AAI was acqui",Wikipedia-sourced,"AAI Corporation is an aerospace and defense development and manufacturing firm, located in Hunt Valley, Maryland, US. Formerly a wholly owned subsidiary of United Industrial Corporation, AAI was acquired by Textron in 2007. It currently operates as a unit of Textron Systems and employs more than 2,000."
AAI Penetrator,aircraft,,,,,,,,,,,Various,aircraft,"The American Aircraft International Penetrator was a military helicopter prototype conceived in 1990 as a gunship conversion of the Bell UH-1 Iroquois, aimed at ground insertion, close support and cou",Wikipedia-sourced,"The American Aircraft International Penetrator was a military helicopter prototype conceived in 1990 as a gunship conversion of the Bell UH-1 Iroquois, aimed at ground insertion, close support and counter-insurgency roles."
AAI RQ-2 Pioneer,UAV,,,,,,,,,,,Various,UAV,"The AAI RQ-2 Pioneer is an unmanned aerial vehicle (UAV) that was used by the United States Navy, Marine Corps, and Army, and deployed at sea and on land from 1986 until 2007. Initially tested aboard ",Wikipedia-sourced,"The AAI RQ-2 Pioneer is an unmanned aerial vehicle (UAV) that was used by the United States Navy, Marine Corps, and Army, and deployed at sea and on land from 1986 until 2007. Initially tested aboard USS Iowa, the RQ-2 Pioneer was placed aboard Iowa-class battleships to provide gunnery spotting, its mission evolving into reconnaissance and surveillance, primarily for amphibious forces."
AAI RQ-7 Shadow,UAV,,,,,,,,,,,Various,UAV,"The AAI RQ-7 Shadow is an American unmanned aerial vehicle (UAV) used by the United States Army, Australian Army, Swedish Army, Turkish Air Force and Italian Army for reconnaissance, surveillance, and",Wikipedia-sourced,"The AAI RQ-7 Shadow is an American unmanned aerial vehicle (UAV) used by the United States Army, Australian Army, Swedish Army, Turkish Air Force and Italian Army for reconnaissance, surveillance, and target acquisition and battle damage assessment. Launched from a trailer-mounted pneumatic catapult, it is recovered with the aid of arresting gear similar to jets on an aircraft carrier."
AAI Sparrowhawk,aircraft,,,,,,,,,,,Various,aircraft,"The AAI SparrowHawk is an American two-seat pusher ultralight autogyro, available in kit form for amateur construction.",Wikipedia-sourced,"The AAI SparrowHawk is an American two-seat pusher ultralight autogyro, available in kit form for amateur construction."
ABC Motors,aircraft,,,,,,,,,,,Various,aircraft,"ABC Motors Limited (""All British (Engine) Company"") of Hersham, Surrey, England was a manufacturer of cars, aircraft, motor scooters, and engines for road and air. Established by Ronald Charteris in H",Wikipedia-sourced,"ABC Motors Limited (""All British (Engine) Company"") of Hersham, Surrey, England was a manufacturer of cars, aircraft, motor scooters, and engines for road and air. Established by Ronald Charteris in Hersham, Surrey in 1912, its chief designer was the young and talented Granville Bradshaw."
ABC Robin,aircraft,,,,,,,,,,,Various,aircraft,"The ABC Robin was a British single-seat light aircraft designed by A. A. (Tony) Fletcher in 1929. It was a high-wing, single-seat monoplane of conventional taildragger configuration.",Wikipedia-sourced,"The ABC Robin was a British single-seat light aircraft designed by A. A. (Tony) Fletcher in 1929. It was a high-wing, single-seat monoplane of conventional taildragger configuration."
ABS Aerolight,aircraft,,,,,,,,,,,Various,aircraft,"ABS Aerolight was a French aircraft manufacturer based in Sérignan-du-Comtat. The company specialized in the design and manufacture of powered parachutes and roadable aircraft, in the form of kits for",Wikipedia-sourced,"ABS Aerolight was a French aircraft manufacturer based in Sérignan-du-Comtat. The company specialized in the design and manufacture of powered parachutes and roadable aircraft, in the form of kits for amateur construction and ready-to-fly aircraft for the European Fédération Aéronautique Internationale microlight category."
ABS Aerolight Legacy,aircraft,ABS Aerolight,,Active,,,,,,,,Various,aircraft,"The ABS Aerolight Legacy is a French powered parachute that was designed and produced by ABS Aerolight of Sérignan-du-Comtat. Now out of production, when it was available the aircraft was supplied as ",Wikipedia-sourced,"The ABS Aerolight Legacy is a French powered parachute that was designed and produced by ABS Aerolight of Sérignan-du-Comtat. Now out of production, when it was available the aircraft was supplied as a complete ready-to-fly-aircraft and as a kit for amateur construction."
ABS Aerolight Navigathor,aircraft,ABS Aerolight,,Active,,,,,,,,Various,aircraft,"The ABS Aerolight Navigathor is a French powered parachute and roadable aircraft that was designed and produced by ABS Aerolight of Sérignan-du-Comtat. Now out of production, when it was available the",Wikipedia-sourced,"The ABS Aerolight Navigathor is a French powered parachute and roadable aircraft that was designed and produced by ABS Aerolight of Sérignan-du-Comtat. Now out of production, when it was available the aircraft was supplied as a complete ready-to-fly-aircraft and as a kit for amateur construction."
ABS Aircraft,aircraft,,,,,,,,,,,Various,aircraft,"ABS Aircraft AG is a Swiss aircraft manufacturer, building Fournier-designed motorgliders. It was founded in Küsnacht (ZH) in 1985.",Wikipedia-sourced,"ABS Aircraft AG is a Swiss aircraft manufacturer, building Fournier-designed motorgliders. It was founded in Küsnacht (ZH) in 1985."
AC Mobil 34,aircraft,,,,,,,,,,,Various,aircraft,AC Mobil 34 is a small French aircraft manufacturer based in Saint-Florentin. The firm produces a light aircraft in kitplane form.,Wikipedia-sourced,AC Mobil 34 is a small French aircraft manufacturer based in Saint-Florentin. The firm produces a light aircraft in kitplane form.
AC Mobil 34 Chrysalin,aircraft,,,Active,,,,,,,,Various,aircraft,The AC Mobil 34 Chrysalin is a two-seat light aircraft produced in France in kitplane form. The aircraft was designed to comply with the Fédération Aéronautique Internationale microlight rules.,Wikipedia-sourced,The AC Mobil 34 Chrysalin is a two-seat light aircraft produced in France in kitplane form. The aircraft was designed to comply with the Fédération Aéronautique Internationale microlight rules.
ACAZ C.2,aircraft,,,,,,,,,,,Various,aircraft,"The ACAZ C.2, Ateliers de Construction Aeronautique de Zeebruge, was a prototype Belgian biplane fighter aircraft built in the 1920s.",Wikipedia-sourced,"The ACAZ C.2, Ateliers de Construction Aeronautique de Zeebruge, was a prototype Belgian biplane fighter aircraft built in the 1920s."
ACAZ T.2,aircraft,,,,,,,,,,,Various,aircraft,"The ACAZ T.1  and T.2, very similar to each other, were the first Belgian all-metal aircraft, flown in 1924. They were single-engined touring monoplanes which seated two.",Wikipedia-sourced,"The ACAZ T.1  and T.2, very similar to each other, were the first Belgian all-metal aircraft, flown in 1924. They were single-engined touring monoplanes which seated two."
ACS-100 Sora,aircraft,,,,,,,,,,,Various,aircraft,"The ACS-100 Sora is a Brazilian two-seat Light Sport Aircraft, designed by Advanced Composites Solutions.",Wikipedia-sourced,"The ACS-100 Sora is a Brazilian two-seat Light Sport Aircraft, designed by Advanced Composites Solutions."
ACS-Itaipu Sora-E,attack,,,,,,,,,,,Various,attack,The Sora-E is a two-seat electric powered aircraft. It is a joint venture between ACS Aviation of Brazil and Itaipu Binacional of Paraguay.,Wikipedia-sourced,The Sora-E is a two-seat electric powered aircraft. It is a joint venture between ACS Aviation of Brazil and Itaipu Binacional of Paraguay.
